id,title,question,resolution,resolved_by,lifecycle_status,disposition,disposition_reason_ref,source_kind,source_span,custom_attributes,last_referenced
OQ-001,Should Guest and Presenter be two distinct roles or one role with a `canPresent` attribute?,Should Guest and Presenter be two distinct roles or one role with a `canPresent` attribute?,Single `Guest/Presenter` role with an `isPresenter` relationship attribute on the invitation; relationship-based ABAC handles the distinction,,Deferred,,,,,"{""v1"": {""ID"": ""OQ-001"", ""Question"": ""Should Guest and Presenter be two distinct roles or one role with a `canPresent` attribute?"", ""Blocking?"": ""No"", ""Resolution"": ""Single `Guest/Presenter` role with an `isPresenter` relationship attribute on the invitation; relationship-based ABAC handles the distinction"", ""Status"": ""Deferred""}}",
OQ-002,Can a user with the Reviewer role cast a vote on a topic they are reviewing?,Can a user with the Reviewer role cast a vote on a topic they are reviewing?,No — Reviewers annotate but do not vote; eligibility is configured per vote from the Member/Chairman/Secretary pool,,Deferred,,,,,"{""v1"": {""ID"": ""OQ-002"", ""Question"": ""Can a user with the Reviewer role cast a vote on a topic they are reviewing?"", ""Blocking?"": ""No"", ""Resolution"": ""No — Reviewers annotate but do not vote; eligibility is configured per vote from the Member/Chairman/Secretary pool"", ""Status"": ""Deferred""}}",
OQ-003,What MFA policy and session idle-timeout should Keycloak enforce?,What MFA policy and session idle-timeout should Keycloak enforce?,"MFA required for Chairman + Secretary, optional for others; 60-minute idle timeout; set in ACMP's own Keycloak realm, no code change",,Deferred,,,,,"{""v1"": {""ID"": ""OQ-003"", ""Question"": ""What MFA policy and session idle-timeout should Keycloak enforce?"", ""Blocking?"": ""Yes"", ""Resolution"": ""MFA required for Chairman + Secretary, optional for others; 60-minute idle timeout; set in ACMP's own Keycloak realm, no code change"", ""Status"": ""Deferred""}}",
OQ-004,Should Submitter-created topics be the same Topic entity or a separate TopicRequest converted after triage?,Should Submitter-created topics be the same Topic entity or a separate TopicRequest converted after triage?,"Merged — one Topic entity; Submitter creates a Draft, Secretary triages directly; avoids entity duplication",,Deferred,,,,,"{""v1"": {""ID"": ""OQ-004"", ""Question"": ""Should Submitter-created topics be the same Topic entity or a separate TopicRequest converted after triage?"", ""Blocking?"": ""No"", ""Resolution"": ""Merged — one Topic entity; Submitter creates a Draft, Secretary triages directly; avoids entity duplication"", ""Status"": ""Deferred""}}",
OQ-005,"Are the aging thresholds (Critical 3d, Urgent 7d, Normal 21d) correct?","Are the aging thresholds (Critical 3d, Urgent 7d, Normal 21d) correct?",Keep Critical 3d / Urgent 7d / Normal 21d until the committee reviews after the PH-1 pilot; thresholds configurable at deploy,,Deferred,,,,,"{""v1"": {""ID"": ""OQ-005"", ""Question"": ""Are the aging thresholds (Critical 3d, Urgent 7d, Normal 21d) correct?"", ""Blocking?"": ""No"", ""Resolution"": ""Keep Critical 3d / Urgent 7d / Normal 21d until the committee reviews after the PH-1 pilot; thresholds configurable at deploy"", ""Status"": ""Deferred""}}",
OQ-006,"Should topic `Source` be free-text or an enum, and what values?","Should topic `Source` be free-text or an enum, and what values?","Enum + Other escape (CommitteeMember, StreamRequest, OperationalIncident, SecurityFinding, RegulatoryRequirement, Innovation, ExternalPartner, Other); enables reporting; Secretary validates list before PH-1",,Deferred,,,,,"{""v1"": {""ID"": ""OQ-006"", ""Question"": ""Should topic `Source` be free-text or an enum, and what values?"", ""Blocking?"": ""No"", ""Resolution"": ""Enum + Other escape (CommitteeMember, StreamRequest, OperationalIncident, SecurityFinding, RegulatoryRequirement, Innovation, ExternalPartner, Other); enables reporting; Secretary validates list before PH-1"", ""Status"": ""Deferred""}}",
OQ-007,What are the canonical Architecture Invariant categories?,What are the canonical Architecture Invariant categories?,"Security, Performance, Data, Interoperability, Compliance, Other — enum with Other escape; Secretary confirms before the PH-2 build",,Deferred,,,,,"{""v1"": {""ID"": ""OQ-007"", ""Question"": ""What are the canonical Architecture Invariant categories?"", ""Blocking?"": ""No"", ""Resolution"": ""Security, Performance, Data, Interoperability, Compliance, Other — enum with Other escape; Secretary confirms before the PH-2 build"", ""Status"": ""Deferred""}}",
OQ-008,Is the committee moving to bi-weekly meetings or staying weekly?,Is the committee moving to bi-weekly meetings or staying weekly?,"Bi-weekly default; cadence is operational config, not hard-coded; SLA thresholds are independent of cadence",,Deferred,,,,,"{""v1"": {""ID"": ""OQ-008"", ""Question"": ""Is the committee moving to bi-weekly meetings or staying weekly?"", ""Blocking?"": ""No"", ""Resolution"": ""Bi-weekly default; cadence is operational config, not hard-coded; SLA thresholds are independent of cadence"", ""Status"": ""Deferred""}}",
OQ-009,Should multiple users edit the draft MoM simultaneously?,Should multiple users edit the draft MoM simultaneously?,No — single editor at a time (last-write-wins with a dirty-lock warning); OOS-07 excludes real-time collab; revisit PH-3 if demanded,,Deferred,,,,,"{""v1"": {""ID"": ""OQ-009"", ""Question"": ""Should multiple users edit the draft MoM simultaneously?"", ""Blocking?"": ""No"", ""Resolution"": ""No — single editor at a time (last-write-wins with a dirty-lock warning); OOS-07 excludes real-time collab; revisit PH-3 if demanded"", ""Status"": ""Deferred""}}",
OQ-010,Are there meeting types beyond regular / extraordinary / emergency?,Are there meeting types beyond regular / extraordinary / emergency?,"Regular, Extraordinary, Emergency as the initial enum with an Other escape; Secretary confirms before the PH-1 build",,Deferred,,,,,"{""v1"": {""ID"": ""OQ-010"", ""Question"": ""Are there meeting types beyond regular / extraordinary / emergency?"", ""Blocking?"": ""No"", ""Resolution"": ""Regular, Extraordinary, Emergency as the initial enum with an Other escape; Secretary confirms before the PH-1 build"", ""Status"": ""Deferred""}}",
OQ-011,Should a Webex Transcript be a first-class artifact type or a blob attachment?,Should a Webex Transcript be a first-class artifact type or a blob attachment?,"First-class artifact (`TRS-YYYY-###`, traceable, independently searchable) for PH-2; a blob makes search and traceability harder",,Deferred,,,,,"{""v1"": {""ID"": ""OQ-011"", ""Question"": ""Should a Webex Transcript be a first-class artifact type or a blob attachment?"", ""Blocking?"": ""No"", ""Resolution"": ""First-class artifact (`TRS-YYYY-###`, traceable, independently searchable) for PH-2; a blob makes search and traceability harder"", ""Status"": ""Deferred""}}",
OQ-012,Serve the React SPA via nginx or ASP.NET Core static files?,Serve the React SPA via nginx or ASP.NET Core static files?,"Resolved (2026-06-25): a separate nginx `web` container proxying `/api`→api ships in v1, overriding the earlier ASP.NET-static default (docs/domain/repository-structure.md §8)",,Approved,,,,,"{""v1"": {""ID"": ""OQ-012"", ""Question"": ""Serve the React SPA via nginx or ASP.NET Core static files?"", ""Blocking?"": ""No"", ""Resolution"": ""Resolved (2026-06-25): a separate nginx `web` container proxying `/api`→api ships in v1, overriding the earlier ASP.NET-static default (docs/domain/repository-structure.md §8)"", ""Status"": ""Approved""}}",
OQ-013,Which OIDC client library should the React app use?,Which OIDC client library should the React app use?,"`oidc-client-ts` + `react-oidc-context` — active, TypeScript-first, native auth-code + PKCE against Keycloak, not Auth0-branded",,Deferred,,,,,"{""v1"": {""ID"": ""OQ-013"", ""Question"": ""Which OIDC client library should the React app use?"", ""Blocking?"": ""No"", ""Resolution"": ""`oidc-client-ts` + `react-oidc-context` — active, TypeScript-first, native auth-code + PKCE against Keycloak, not Auth0-branded"", ""Status"": ""Deferred""}}",
OQ-014,GUID (newsequentialid) or BIGINT IDENTITY as the clustered key for governed entities?,GUID (newsequentialid) or BIGINT IDENTITY as the clustered key for governed entities?,BIGINT IDENTITY clustered key + GUID alternate unique key for external refs; human-readable `TOP-YYYY-###` remain separate display IDs,,Deferred,,,,,"{""v1"": {""ID"": ""OQ-014"", ""Question"": ""GUID (newsequentialid) or BIGINT IDENTITY as the clustered key for governed entities?"", ""Blocking?"": ""No"", ""Resolution"": ""BIGINT IDENTITY clustered key + GUID alternate unique key for external refs; human-readable `TOP-YYYY-###` remain separate display IDs"", ""Status"": ""Deferred""}}",
OQ-015,Store ballots as a JSON column or a fully normalized table?,Store ballots as a JSON column or a fully normalized table?,"Normalized table (VoteSession, VoteOption, VoteCast rows); per-row immutability and hash-chain integrity are easier to enforce and audit",,Deferred,,,,,"{""v1"": {""ID"": ""OQ-015"", ""Question"": ""Store ballots as a JSON column or a fully normalized table?"", ""Blocking?"": ""No"", ""Resolution"": ""Normalized table (VoteSession, VoteOption, VoteCast rows); per-row immutability and hash-chain integrity are easier to enforce and audit"", ""Status"": ""Deferred""}}",
OQ-016,Should the notification center poll the server or receive WebSocket/SSE push?,Should the notification center poll the server or receive WebSocket/SSE push?,Short polling at a 30-second interval in PH-1; OOS-15 rejects WebSocket infrastructure; revisit PH-3 if users report staleness,,Deferred,,,,,"{""v1"": {""ID"": ""OQ-016"", ""Question"": ""Should the notification center poll the server or receive WebSocket/SSE push?"", ""Blocking?"": ""No"", ""Resolution"": ""Short polling at a 30-second interval in PH-1; OOS-15 rejects WebSocket infrastructure; revisit PH-3 if users report staleness"", ""Status"": ""Deferred""}}",
OQ-017,"Is the 8-type relationship enum final, or should admins define custom types?","Is the 8-type relationship enum final, or should admins define custom types?","Fixed enum of 8 types in v1 (add an Other escape if needed); custom types add UI, migration risk, and semantic dilution; re-evaluate PH-3",,Deferred,,,,,"{""v1"": {""ID"": ""OQ-017"", ""Question"": ""Is the 8-type relationship enum final, or should admins define custom types?"", ""Blocking?"": ""No"", ""Resolution"": ""Fixed enum of 8 types in v1 (add an Other escape if needed); custom types add UI, migration risk, and semantic dilution; re-evaluate PH-3"", ""Status"": ""Deferred""}}",
OQ-018,What max node cap protects the transitive impact-analysis query?,What max node cap protects the transitive impact-analysis query?,"Depth limit of 3 hops + a 200-node total cap; on overflow, return partial results with a ""graph truncated"" warning",,Deferred,,,,,"{""v1"": {""ID"": ""OQ-018"", ""Question"": ""What max node cap protects the transitive impact-analysis query?"", ""Blocking?"": ""No"", ""Resolution"": ""Depth limit of 3 hops + a 200-node total cap; on overflow, return partial results with a \""graph truncated\"" warning"", ""Status"": ""Deferred""}}",
OQ-019,Should the OpenAPI/Swagger UI be enabled in production?,Should the OpenAPI/Swagger UI be enabled in production?,Disabled in production (available in dev and staging only per FR-008); auditors use the staging Swagger or a downloaded spec,,Deferred,,,,,"{""v1"": {""ID"": ""OQ-019"", ""Question"": ""Should the OpenAPI/Swagger UI be enabled in production?"", ""Blocking?"": ""No"", ""Resolution"": ""Disabled in production (available in dev and staging only per FR-008); auditors use the staging Swagger or a downloaded spec"", ""Status"": ""Deferred""}}",
OQ-020,Keep the standby VM warm or cold?,Keep the standby VM warm or cold?,"Warm standby if budget permits, else cold standby with a documented ≤8h restore procedure; Secretary confirms the availability budget",,Deferred,,,,,"{""v1"": {""ID"": ""OQ-020"", ""Question"": ""Keep the standby VM warm or cold?"", ""Blocking?"": ""Yes"", ""Resolution"": ""Warm standby if budget permits, else cold standby with a documented ≤8h restore procedure; Secretary confirms the availability budget"", ""Status"": ""Deferred""}}",
OQ-021,"Include a mobile (phone) breakpoint in PH-1, or tablet + desktop only?","Include a mobile (phone) breakpoint in PH-1, or tablet + desktop only?",Tablet + desktop only (≥768px) in PH-1; committee use is desk/laptop/tablet; mobile deferred to PH-3 if a need is demonstrated,,Deferred,,,,,"{""v1"": {""ID"": ""OQ-021"", ""Question"": ""Include a mobile (phone) breakpoint in PH-1, or tablet + desktop only?"", ""Blocking?"": ""No"", ""Resolution"": ""Tablet + desktop only (≥768px) in PH-1; committee use is desk/laptop/tablet; mobile deferred to PH-3 if a need is demonstrated"", ""Status"": ""Deferred""}}",
OQ-022,"Which charting library should dashboards use, and is it RTL-validated?","Which charting library should dashboards use, and is it RTL-validated?","Resolved (2026-07-05, ADR-0022): no chart library — charts are CSS primitives (`rpt-*` renderers); RTL via logical properties + `dir`, verified by live VR",,Approved,,,,,"{""v1"": {""ID"": ""OQ-022"", ""Question"": ""Which charting library should dashboards use, and is it RTL-validated?"", ""Blocking?"": ""No"", ""Resolution"": ""Resolved (2026-07-05, ADR-0022): no chart library — charts are CSS primitives (`rpt-*` renderers); RTL via logical properties + `dir`, verified by live VR"", ""Status"": ""Approved""}}",
OQ-023,Generate export PDFs server-side or browser-side?,Generate export PDFs server-side or browser-side?,Tarseem for diagram PDF; browser `window.print()` for report PDF in PH-1/PH-2; avoids a server-side PDF library; evaluate QuestPDF in PH-3 if needed,,Deferred,,,,,"{""v1"": {""ID"": ""OQ-023"", ""Question"": ""Generate export PDFs server-side or browser-side?"", ""Blocking?"": ""No"", ""Resolution"": ""Tarseem for diagram PDF; browser `window.print()` for report PDF in PH-1/PH-2; avoids a server-side PDF library; evaluate QuestPDF in PH-3 if needed"", ""Status"": ""Deferred""}}",
OQ-024,What TLS / cipher / mTLS policy applies to the HTTPS endpoint?,What TLS / cipher / mTLS policy applies to the HTTPS endpoint?,TLS 1.2+ on the public endpoint (1.3 preferred if all clients support it); no mTLS in v1 for internal Compose-network services,,Deferred,,,,,"{""v1"": {""ID"": ""OQ-024"", ""Question"": ""What TLS / cipher / mTLS policy applies to the HTTPS endpoint?"", ""Blocking?"": ""Yes"", ""Resolution"": ""TLS 1.2+ on the public endpoint (1.3 preferred if all clients support it); no mTLS in v1 for internal Compose-network services"", ""Status"": ""Deferred""}}",
OQ-025,Require dual-control or audit + alert for high-sensitivity operations?,Require dual-control or audit + alert for high-sensitivity operations?,Audit log + anomaly alert in v1; dual-control is too heavy for a ≤20-user system; immutable log + hash chain + Auditor notice suffice; review if classification escalates,,Deferred,,,,,"{""v1"": {""ID"": ""OQ-025"", ""Question"": ""Require dual-control or audit + alert for high-sensitivity operations?"", ""Blocking?"": ""No"", ""Resolution"": ""Audit log + anomaly alert in v1; dual-control is too heavy for a ≤20-user system; immutable log + hash chain + Auditor notice suffice; review if classification escalates"", ""Status"": ""Deferred""}}",
OQ-026,Should ACMP scan uploaded files for malware before storage?,Should ACMP scan uploaded files for malware before storage?,"MIME-type + extension whitelist validation in v1 (PDF, DOCX, PPTX, XLSX, PNG, JPG, SVG, MP4, MP3, ZIP, JSON); ClamAV Compose sidecar if the org requires scanning",,Deferred,,,,,"{""v1"": {""ID"": ""OQ-026"", ""Question"": ""Should ACMP scan uploaded files for malware before storage?"", ""Blocking?"": ""No"", ""Resolution"": ""MIME-type + extension whitelist validation in v1 (PDF, DOCX, PPTX, XLSX, PNG, JPG, SVG, MP4, MP3, ZIP, JSON); ClamAV Compose sidecar if the org requires scanning"", ""Status"": ""Deferred""}}",
OQ-027,"Which SAST/DAST tools run in CI, and do failing scans block merges?","Which SAST/DAST tools run in CI, and do failing scans block merges?","Semgrep OSS SAST on every PR (block on high severity); OWASP ZAP baseline on staging (alert, not block in v1); dependency scan via `dotnet list package --vulnerable` + `npm audit`",,Deferred,,,,,"{""v1"": {""ID"": ""OQ-027"", ""Question"": ""Which SAST/DAST tools run in CI, and do failing scans block merges?"", ""Blocking?"": ""No"", ""Resolution"": ""Semgrep OSS SAST on every PR (block on high severity); OWASP ZAP baseline on staging (alert, not block in v1); dependency scan via `dotnet list package --vulnerable` + `npm audit`"", ""Status"": ""Deferred""}}",
OQ-028,Use a strict nonce/hash CSP or a domain allowlist?,Use a strict nonce/hash CSP or a domain allowlist?,"`script-src 'self'` (no unsafe-inline, no unsafe-eval) for the Vite-built SPA + a report-uri endpoint; switch to nonce only if inline scripts become required",,Deferred,,,,,"{""v1"": {""ID"": ""OQ-028"", ""Question"": ""Use a strict nonce/hash CSP or a domain allowlist?"", ""Blocking?"": ""No"", ""Resolution"": ""`script-src 'self'` (no unsafe-inline, no unsafe-eval) for the Vite-built SPA + a report-uri endpoint; switch to nonce only if inline scripts become required"", ""Status"": ""Deferred""}}",
OQ-029,Does the org require a formal pen-test sign-off before production deploy?,Does the org require a formal pen-test sign-off before production deploy?,Internal security review by the designated reviewer before PH-1 go-live; schedule a formal pen-test as a PH-1 gate if org policy requires it,,Deferred,,,,,"{""v1"": {""ID"": ""OQ-029"", ""Question"": ""Does the org require a formal pen-test sign-off before production deploy?"", ""Blocking?"": ""No"", ""Resolution"": ""Internal security review by the designated reviewer before PH-1 go-live; schedule a formal pen-test as a PH-1 gate if org policy requires it"", ""Status"": ""Deferred""}}",
OQ-030,Which CI system runs the automated test + build pipeline?,Which CI system runs the automated test + build pipeline?,"GitHub Actions self-hosted runner if outbound GitHub is allowed, else GitLab CI if the org uses GitLab; decide before PH-0 repo initialization",,Deferred,,,,,"{""v1"": {""ID"": ""OQ-030"", ""Question"": ""Which CI system runs the automated test + build pipeline?"", ""Blocking?"": ""Yes"", ""Resolution"": ""GitHub Actions self-hosted runner if outbound GitHub is allowed, else GitLab CI if the org uses GitLab; decide before PH-0 repo initialization"", ""Status"": ""Deferred""}}",
OQ-031,Push and pull images via a private registry or a public one?,Push and pull images via a private registry or a public one?,Public registry with digest pinning for dev/staging; a private on-prem mirror is strongly recommended for production; coordinate with org IT in PH-0,,Deferred,,,,,"{""v1"": {""ID"": ""OQ-031"", ""Question"": ""Push and pull images via a private registry or a public one?"", ""Blocking?"": ""Yes"", ""Resolution"": ""Public registry with digest pinning for dev/staging; a private on-prem mirror is strongly recommended for production; coordinate with org IT in PH-0"", ""Status"": ""Deferred""}}",
OQ-032,Must NuGet and npm packages be mirrored to an internal feed?,Must NuGet and npm packages be mirrored to an internal feed?,Direct internet access assumed; set up a NuGet + npm mirror in PH-0 if the VM is air-gapped or policy requires it (blocking if not addressed early),,Deferred,,,,,"{""v1"": {""ID"": ""OQ-032"", ""Question"": ""Must NuGet and npm packages be mirrored to an internal feed?"", ""Blocking?"": ""Yes"", ""Resolution"": ""Direct internet access assumed; set up a NuGet + npm mirror in PH-0 if the VM is air-gapped or policy requires it (blocking if not addressed early)"", ""Status"": ""Deferred""}}",
OQ-033,What initial KPI dashboard threshold values apply with no historical baseline?,What initial KPI dashboard threshold values apply with no historical baseline?,Admin-configurable thresholds; show KPI trend without RAG status until the committee sets thresholds after 90 days of live data,,Deferred,,,,,"{""v1"": {""ID"": ""OQ-033"", ""Question"": ""What initial KPI dashboard threshold values apply with no historical baseline?"", ""Blocking?"": ""No"", ""Resolution"": ""Admin-configurable thresholds; show KPI trend without RAG status until the committee sets thresholds after 90 days of live data"", ""Status"": ""Deferred""}}",
OQ-034,Is SQL Server's Arabic word-breaker adequate for committee terminology?,Is SQL Server's Arabic word-breaker adequate for committee terminology?,"**Resolved (P15f, 2026-07-15):** spike on the FTS-enabled deploy image (`mssql-server-fts`) → Arabic word-breaker (lcid 1025) present; FREETEXT micro-recall **82.9% ≥ 80%** over 20 committee-term queries (misses Arabic *derivation* which the provider's LIKE booster recovers). **Engine = SQL Server FTS + LIKE booster (single datastore; INV-002 not triggered, no OpenSearch, no ADR).** Evidence: `SearchProvidersFtsTests` (real-stack, AC-061), ph0-validation §7.",,Implemented,,,,,"{""v1"": {""ID"": ""OQ-034"", ""Question"": ""Is SQL Server's Arabic word-breaker adequate for committee terminology?"", ""Blocking?"": ""Yes"", ""Resolution"": ""**Resolved (P15f, 2026-07-15):** spike on the FTS-enabled deploy image (`mssql-server-fts`) → Arabic word-breaker (lcid 1025) present; FREETEXT micro-recall **82.9% ≥ 80%** over 20 committee-term queries (misses Arabic *derivation* which the provider's LIKE booster recovers). **Engine = SQL Server FTS + LIKE booster (single datastore; INV-002 not triggered, no OpenSearch, no ADR).** Evidence: `SearchProvidersFtsTests` (real-stack, AC-061), ph0-validation §7."", ""Status"": ""Resolved""}}",
OQ-035,Confirm the Urgency SLA thresholds (validation item for FR-038).,Confirm the Urgency SLA thresholds (validation item for FR-038).,"Critical 3d, Urgent 7d, Normal 21d; configurable; adjust post-PH-1 pilot (duplicate of OQ-005)",,Deferred,,,,,"{""v1"": {""ID"": ""OQ-035"", ""Question"": ""Confirm the Urgency SLA thresholds (validation item for FR-038)."", ""Blocking?"": ""No"", ""Resolution"": ""Critical 3d, Urgent 7d, Normal 21d; configurable; adjust post-PH-1 pilot (duplicate of OQ-005)"", ""Status"": ""Deferred""}}",
OQ-036,Confirm the Architecture Invariant category enum (validation item for FR-106).,Confirm the Architecture Invariant category enum (validation item for FR-106).,"Security, Performance, Data, Interoperability, Compliance, Other (duplicate of OQ-007)",,Deferred,,,,,"{""v1"": {""ID"": ""OQ-036"", ""Question"": ""Confirm the Architecture Invariant category enum (validation item for FR-106)."", ""Blocking?"": ""No"", ""Resolution"": ""Security, Performance, Data, Interoperability, Compliance, Other (duplicate of OQ-007)"", ""Status"": ""Deferred""}}",
OQ-037,"Which LLM endpoint powers PH-3 AI extraction, and is data residency confirmed?","Which LLM endpoint powers PH-3 AI extraction, and is data residency confirmed?",Not determined; the feature is off by default; the org must confirm the LLM provider + data-residency before Admin can activate; no code is blocked,,Deferred,,,,,"{""v1"": {""ID"": ""OQ-037"", ""Question"": ""Which LLM endpoint powers PH-3 AI extraction, and is data residency confirmed?"", ""Blocking?"": ""No"", ""Resolution"": ""Not determined; the feature is off by default; the org must confirm the LLM provider + data-residency before Admin can activate; no code is blocked"", ""Status"": ""Deferred""}}",
OQ-038,Where does the self-hosted Keycloak keep its own operational store?,Where does the self-hosted Keycloak keep its own operational store?,Dedicated Postgres-for-Keycloak container (confirm via a PH-0 spike); app data stays SQL-only (ADR-0003); backup/restore must cover the chosen store,,Deferred,,,,,"{""v1"": {""ID"": ""OQ-038"", ""Question"": ""Where does the self-hosted Keycloak keep its own operational store?"", ""Blocking?"": ""Yes"", ""Resolution"": ""Dedicated Postgres-for-Keycloak container (confirm via a PH-0 spike); app data stays SQL-only (ADR-0003); backup/restore must cover the chosen store"", ""Status"": ""Deferred""}}",
OQ-039,Should ACMP's Keycloak later broker/federate to an organizational IdP?,Should ACMP's Keycloak later broker/federate to an organizational IdP?,No upstream federation in v1; keep the ACMP realm broker-capable so a future org IdP can be added without rework,,Deferred,,,,,"{""v1"": {""ID"": ""OQ-039"", ""Question"": ""Should ACMP's Keycloak later broker/federate to an organizational IdP?"", ""Blocking?"": ""No"", ""Resolution"": ""No upstream federation in v1; keep the ACMP realm broker-capable so a future org IdP can be added without rework"", ""Status"": ""Deferred""}}",
OQ-040,Which SQL Server edition runs the bundled production instance?,Which SQL Server edition runs the bundled production instance?,Evaluate at deploy phase P18: start with Express but verify columnstore + FTS availability and that the 10GB/DB + memory caps fit ≤20 users; escalate to Standard if limits bind,,Deferred,,,,,"{""v1"": {""ID"": ""OQ-040"", ""Question"": ""Which SQL Server edition runs the bundled production instance?"", ""Blocking?"": ""No"", ""Resolution"": ""Evaluate at deploy phase P18: start with Express but verify columnstore + FTS availability and that the 10GB/DB + memory caps fit ≤20 users; escalate to Standard if limits bind"", ""Status"": ""Deferred""}}",
